{"flow_id":"authentication-user-identity-persistence-v1","document_status":"DRAFT","work_status":"READY","scope":"FEDERATED_USER_IDENTITY_PERSISTENCE","binary_upload":"NOT_APPLICABLE","schema_change":"MIGRATION_APPLIED","api_contract_change":"NOT_PROPOSED","current_gate":"READY_FOR_GOOGLE_LINKING_STAGE","blocked_by":[],"known_gaps":["Google login is NOT_STARTED","Account linking is NOT_STARTED","Onboarding is NOT_STARTED","Frontend is NOT_STARTED","Human Test is NOT_EXECUTED"],"updated_at":"2026-07-12T18:30:00+07:00"}
