{"flow_id":"authentication-google-account-linking-foundation-v1","document_status":"DRAFT","work_status":"READY","scope":"SECURE_GOOGLE_ACCOUNT_LINKING_BACKEND","binary_upload":"NOT_APPLICABLE","schema_change":"MIGRATION_APPLIED","api_contract_change":"ADDITIVE_COMMAND_ENDPOINTS","current_gate":"READY_FOR_GOOGLE_LINKING_FRONTEND","blocked_by":[],"known_gaps":["Frontend Linking UX is NOT_STARTED","Google Login is NOT_STARTED","Onboarding is NOT_STARTED","Human Test is NOT_EXECUTED"],"updated_at":"2026-07-12T20:30:00+07:00"}
