{"flow_id":"laundry-activity-timeline-v1","document_status":"DRAFT","work_status":"READY","scope":"READ_ONLY_DURABLE_WORK_ACTIVITY","binary_upload":"NOT_APPLICABLE","schema_change":"NOT_PROPOSED","api_contract_change":"ADDITIVE_READ_ENDPOINT","current_gate":"FLOW_READY_FOR_TEST","blocked_by":[],"known_gaps":["Human browser verification remains pending","Exact image update/cover/delete actions are omitted where durable evidence is insufficient"],"updated_at":"2026-07-11T17:45:00+07:00"}
