{"flow_id":"authentication-google-verification-foundation-v1","document_status":"DRAFT","work_status":"READY","scope":"GOOGLE_ID_TOKEN_VERIFICATION_FOUNDATION","binary_upload":"NOT_APPLICABLE","schema_change":"NOT_PROPOSED","api_contract_change":"NOT_PROPOSED","current_gate":"READY_FOR_GOOGLE_IDENTITY_PERSISTENCE","blocked_by":[],"known_gaps":["Real Google credential verification requires environment Client ID and future integration-stage evidence","UserIdentity persistence, login, linking, onboarding and Frontend UI are intentionally not started"],"updated_at":"2026-07-12T17:00:00+07:00"}
