{"flow_id":"authentication-google-login-existing-identity-v1","document_status":"APPROVED","work_status":"COMPLETED","scope":"GOOGLE_LOGIN_EXISTING_IDENTITY","binary_upload":"NOT_APPLICABLE","schema_change":"NOT_PROPOSED","api_contract_change":"ADDITIVE","current_gate":"COMPLETED","blocked_by":[],"known_gaps":["First-time Google onboarding / Google registration remains NOT_STARTED"],"updated_at":"2026-07-12T22:23:51+07:00"}
