{"flow_id":"deployment-architecture-foundation-v1","document_status":"APPROVED","work_status":"IMPLEMENTED_PENDING_VERIFICATION","scope":"DEPLOYMENT_ARCHITECTURE_AND_MONOREPO_ALIGNMENT","binary_upload":"NOT_APPLICABLE","schema_change":"NONE","api_contract_change":"NONE","current_gate":"PREVIEW_DEPLOYMENT_RECONFIGURATION","blocked_by":[],"known_gaps":["Human Verification is DEFERRED_TO_PREVIEW_DEPLOYMENT_RECONFIGURATION","Dashboard settings were documented but not changed","No Render Preview service is claimed","Commit and Push are NOT PERFORMED"],"updated_at":"2026-07-13T14:00:00+07:00"}
