{"flow_id":"authentication-persistent-device-session-v1","document_status":"DRAFT","work_status":"READY","scope":"AUTHENTICATION_PERSISTENT_DEVICE_SESSION_STAGE_A","binary_upload":"NOT_APPLICABLE","schema_change":"MIGRATION_APPLIED","api_contract_change":"ADDITIVE_COMMAND_ENDPOINTS","current_gate":"READY_FOR_AUTH_SESSION_HUMAN_RETEST","blocked_by":[],"known_gaps":["Human browser retest of remembered session restoration remains pending","Human multi-device verification remains pending","Google Sign-In and Passkey/WebAuthn are later stages"],"updated_at":"2026-07-12T16:00:00+07:00"}
