{"flow_id":"saas-platform-foundation-blueprint-v1","document_status":"APPROVED","work_status":"READY","scope":"DOCUMENTATION_ONLY_SAAS_PLATFORM_FOUNDATION_ARCHITECTURE","binary_upload":"NOT_APPLICABLE","schema_change":"APPROVED_DIRECTION_NOT_IMPLEMENTED","api_contract_change":"APPROVED_DIRECTION_NOT_IMPLEMENTED","current_gate":"LOCKED_FOR_FOUNDATION_PLANNING","blocked_by":[],"known_gaps":["Product Implementation is NOT_STARTED","Google Registration is WAITING_FOR_FOUNDATION_SELECTION","Platform MFA and recovery remain OPEN","Support impersonation approval remains OPEN","Commercial plan details and billing integration remain OPEN","Audit retention and tamper evidence remain OPEN","Platform LegalOrganization and duplicate-email wording remain OPEN","Multi-Laundry legal-client sharing remains DEFERRED"],"updated_at":"2026-07-12T23:30:00+07:00"}
