{"flow_id":"saas-tenant-membership-foundation-v1","document_status":"APPROVED","work_status":"COMPLETED","scope":"TENANT_LAUNDRY_WORKSPACE_BRANCH_MEMBERSHIP_FOUNDATION","binary_upload":"NOT_APPLICABLE","schema_change":"ADDITIVE_MIGRATION_APPLIED","api_contract_change":"NONE","current_gate":"COMPLETED","blocked_by":[],"known_gaps":["Runtime authorization switch is deferred; legacy actor claims remain authoritative","Tenant provisioning is deferred","Invitation, Google Registration, Subscription, PlatformAccess, and SuperAdmin are deferred","Google-registration-dependent onboarding tests are DEFERRED_TO_NEXT_MISSION"],"updated_at":"2026-07-13T12:30:00+07:00"}
