{"flow_id":"saas-identity-no-business-context-foundation-v1","document_status":"APPROVED","work_status":"COMPLETED","scope":"PASSWORDLESS_IDENTITY_AND_NO_BUSINESS_CONTEXT_FOUNDATION","binary_upload":"NOT_APPLICABLE","schema_change":"ADDITIVE_MIGRATION_APPLIED","api_contract_change":"ADDITIVE_SESSION_FIELDS","current_gate":"COMPLETED","blocked_by":[],"known_gaps":["Google Registration is NOT_STARTED","Tenant Foundation is NOT_STARTED","Onboarding page is a guarded placeholder only"],"updated_at":"2026-07-13T09:00:00+07:00"}
