{"flow_id":"authentication-google-linking-ux-v1","document_status":"DRAFT","work_status":"READY","scope":"AUTHENTICATED_GOOGLE_LINKING_AND_UNLINKING_UX","binary_upload":"NOT_APPLICABLE","schema_change":"NOT_PROPOSED","api_contract_change":"NOT_PROPOSED","current_gate":"READY_FOR_GOOGLE_LOGIN_STAGE","blocked_by":[],"known_gaps":["Google Client IDs must be configured for Human Test","Google Login is NOT_STARTED","Onboarding is NOT_STARTED"],"updated_at":"2026-07-12T17:00:00+07:00"}