{"flow_id":"authentication-google-registration-onboarding-v1","document_status":"APPROVED","work_status":"IMPLEMENTED_PENDING_VERIFICATION","scope":"EXPLICIT_GOOGLE_REGISTRATION_AND_FIRST_TIME_ONBOARDING","binary_upload":"NOT_APPLICABLE","schema_change":"NONE","api_contract_change":"ADDITIVE_GOOGLE_REGISTER_ROUTE","current_gate":"AUTHENTICATION_ONBOARDING_MILESTONE","blocked_by":[],"known_gaps":["Human Verification is DEFERRED_TO_AUTHENTICATION_ONBOARDING_MILESTONE","INVITATION_ONLY has fail-closed mode behavior but no invitation flow","Tenant provisioning and onboarding completion are deferred","Commit and Push are NOT PERFORMED"],"updated_at":"2026-07-13T13:00:00+07:00"}
