{
  "flow_id": "laundry-claim-operational-capability-v1",
  "document_status": "ACTIVE",
  "work_status": "COMPLETED",
  "scope": "CLAIM_OPERATIONAL_CAPABILITY_V1",
  "binary_upload": "NOT_APPLICABLE",
  "schema_change": "IMPLEMENTED_AND_MIGRATED",
  "api_contract_change": "ADDITIVE_EXPLICIT_CLAIM_COMMANDS",
  "current_gate": "INTEGRATION_VERIFIED_COMPLETE",
  "blocked_by": [],
  "known_gaps": ["Focused Frontend test capability is unavailable"],
  "updated_at": "2026-07-11T22:30:00+07:00"
}
